track,album,album_type,artist,album_duration,release_date,recording_period,recording_location,album_genre,album_styles,album_moods,album_themes,genres,styles,moods,themes,composers,user_rating
Scenery,Mirror Ball,studio,Neil Young,55:21:00,,"January 26, 1995 - February 26, 1995","A & M Studios, Hollywood, CA",Pop/Rock,"Album Rock, American Trad Rock, Country-Rock, Hard Rock","Pastoral, Rustic, Gritty, Sentimental, Calm/Peaceful, Gutsy, Insular, Intimate, Laid-Back/Mellow, Melancholy, Plaintive, Reflective, Relaxed, Sad, Weary, Wistful, Yearning, Autumnal, Bittersweet, Earthy, Literate","Comfort, Drinking, Feeling Blue, Heartache, Late Night, Regret, Reflection",Pop/Rock,"Album Rock, American Trad Rock, Country-Rock, Hard Rock, Singer/Songwriter, Southern Rock","Gritty, Sentimental, Aggressive, Earnest, Earthy, Gutsy, Literate, Melancholy, Messy, Organic, Poignant, Ramshackle, Reflective, Rollicking, Rowdy, Weary","Drinking, Feeling Blue, Introspection, Reflection, Regret",Neil Young,6.0
Season of the Witch,Super Session,studio,Stephen Stills,50:22:00,1968,1968,,Blues,"Blues-Rock, Electric Chicago Blues, Regional Blues, Modern Electric Chicago Blues","Bittersweet, Freewheeling, Passionate, Playful, Reverent, Rousing, Street-Smart","Hanging Out, Imagination, Late Night, Relaxation, Road Trip","R&B, Pop/Rock","Psychedelic/Garage, Soul, Blues-Rock, Jam Bands, Psychedelic Soul",,,Donovan,9.0
Secret Dancer,For Free,studio,David Crosby,37:29:00,,," Groove Masters, Santa Monica HZ Werks, Van Nuys Joel Jacks Studios, Santa Ynez ","Folk, Pop/Rock","Contemporary Singer/Songwriter, Jazz-Rock, Adult Contemporary","Melodic, Introspective, Lyrical, Playful, Warm, Agreeable, Earnest, Earthy, Fun, Graceful, Passionate, Sprightly, Uplifting, Flowing, Soothing","Introspection, Reflection, Sunday Afternoon, Daydreaming, Open Road",,,,,"David Crosby, James Raymond",7.0
See the Changes,CSN,studio,"Crosby, Stills & Nash",43:50:00,,,,Pop/Rock,"Contemporary Pop/Rock, Singer/Songwriter, Soft Rock, Album Rock","Pastoral, Laid-Back/Mellow, Amiable/Good-Natured, Gentle, Organic, Poignant, Relaxed, Sentimental, Smooth, Soothing, Summery, Sweet, Warm, Autumnal, Earnest, Intimate, Reflective, Wistful","Politics/Society, Introspection, Affection/Fondness, Heartbreak, Reflection, Relationships","Folk, Pop/Rock","Folk-Pop, Singer/Songwriter","Rousing, Yearning",,Stephen Stills,8.0
See the Sky About to Rain,On the Beach,studio,Neil Young,39:34:00,,"November 30, 1973 - April 7, 1974","Broken Arrow Studios, San Francisco, CA",Pop/Rock,"Country-Rock, Singer/Songwriter, Album Rock","Druggy, Earthy, Messy, Ramshackle, Urgent, Weary, Ambitious, Difficult, Pastoral, Rustic, Searching, Acerbic, Angst-Ridden, Autumnal, Bittersweet, Brooding, Cathartic, Complex, Earnest, Eccentric, Intimate, Laid-Back/Mellow, Lazy, Literate, Melancholy, Nocturnal, Organic, Plaintive, Poignant, Provocative, Quirky, Reflective, Rousing, Sad, Somber, Volatile, Wistful, Confrontational, Harsh, Cerebral, Meandering, Refined, Angry, Bitter, Brash, Exuberant, Nihilistic, Self-Conscious, Aggressive, Bleak, Cynical/Sarcastic, Eerie, Gentle, Gloomy, Rollicking, Rowdy, Sweet, Trippy","Autumn, Loss/Grief, Politics/Society, Reflection, Feeling Blue, Introspection, Heartache, Late Night, Solitude",Pop/Rock,"Album Rock, Singer/Songwriter, Country-Rock, Folk-Rock, Psychedelic/Garage","Bittersweet, Laid-Back/Mellow, Melancholy, Messy, Plaintive, Poignant, Ramshackle, Reflective, Relaxed, Searching, Warm, Weary, Wistful, Yearning, Earnest, Intimate, Literate, Sentimental","Feeling Blue, Heartache, Introspection, Late Night, Rainy Day, Reflection, Regret, Reminiscing, Solitude, The Great Outdoors",Neil Young,10.0
See You In Prague,Innocent Eyes,studio,Graham Nash,34:10:00,1986,," Devonshire Studios, LA, CA Longview Farms, Worcester, MA Rudy Records, LA, CA ",Pop/Rock,Contemporary Singer/Songwriter,,,,,,,"Davitt Siegerson, Richie Zito",
Seen Enough,Looking Forward,studio,"Crosby, Stills, Nash & Young",52:54:00,,"January 23, 1997 - July 21, 1999"," Conway Studio, l Ain Bou Kellal Ga Ga's Room, Los Angeles, CA Ocean Studios, Burbank, CA ",Pop/Rock,"Contemporary Pop/Rock, Singer/Songwriter, Album Rock","Soothing, Pastoral, Sentimental, Smooth, Gentle, Laid-Back/Mellow, Relaxed, Summery, Sweet, Warm, Amiable/Good-Natured, Organic, Poignant, Autumnal, Earnest, Intimate, Reflective, Wistful, Literate","Affection/Fondness, Healing/Comfort, Lifecycle, Politics/Society, Zeitgeist, Reflection, World View, Parenthood, The Great Outdoors",Pop/Rock,"Contemporary Pop/Rock, Folk-Rock, Psychedelic/Garage, Singer/Songwriter",Calm/Peaceful,,Stephen Stills,7.0
Sell Me a Diamond,Sky Trails,studio,David Crosby,50:29:00,,," Groove Masters Studios, Santa Monica Rumor Mill Recording, Santa Ynez The Bamboom Room, Altadena ",Folk,"Contemporary Singer/Songwriter, Folk-Pop","Melodic, Introspective, Lyrical, Playful, Warm, Agreeable, Earnest, Earthy, Fun, Graceful, Passionate, Sprightly, Uplifting, Flowing, Soothing","Introspection, Reflection, Sunday Afternoon, Daydreaming, Open Road",,,,,"David Crosby, James Raymond",7.0
Senator Stills,Back in Time,studio,Stephen Stills,20:00,7/11/2017,,,,,,,,,,,Stephen Stills,5.0
Separate Ways,Homegrown,studio,Neil Young,35:17:00,,," Broken Arrow Ranch Studio, Woodside, CA Quadraphonic Studios, Nashville Ramport Studios, London ",Pop/Rock,"Country-Rock, Singer/Songwriter, Soft Rock, Album Rock","Calm/Peaceful, Druggy, Light, Messy, Ramshackle, Relaxed, Soft/Quiet, Soothing, Sweet, Urgent, Warm, Weary, Angst-Ridden, Autumnal, Bittersweet, Brooding, Cathartic, Intimate, Laid-Back/Mellow, Lazy, Melancholy, Plaintive, Poignant, Reflective, Sad, Smooth, Somber, Wistful, Gentle","Open Road, Reflection, Relaxation, Reminiscing, Sunday Afternoon, Day Driving, The Great Outdoors, Daydreaming, Stay in Bed, Good Times, Loss/Grief",,,,,Neil Young,9.0
Set That Baggage Down,Croz,studio,David Crosby,47:03:00,,," Groove Masters, Santa Monica, CA Jazz At The Lincoln Center, New York, NY Radio Hill Recorders, Los Angeles, CA ",Pop/Rock,"Contemporary Pop/Rock, Contemporary Singer/Songwriter","Earnest, Poignant, Refined, Somber, Self-Conscious, Bittersweet, Brooding, Intimate, Laid-Back/Mellow, Literate, Reflective, Relaxed, Searching","Autumn, Early Morning, Introspection, Long Walk, Rainy Day, Reflection, Regret, Relaxation, Reminiscing, Solitude, Stay in Bed, Sunday Afternoon",,,,,"David Crosby, Shane Fontayne",7.0
Shadow Captain,CSN,studio,"Crosby, Stills & Nash",43:50:00,,,,Pop/Rock,"Contemporary Pop/Rock, Singer/Songwriter, Soft Rock, Album Rock","Pastoral, Laid-Back/Mellow, Amiable/Good-Natured, Gentle, Organic, Poignant, Relaxed, Sentimental, Smooth, Soothing, Summery, Sweet, Warm, Autumnal, Earnest, Intimate, Reflective, Wistful","Politics/Society, Introspection, Affection/Fondness, Heartbreak, Reflection, Relationships",Pop/Rock,Singer/Songwriter,"Nostalgic, Sentimental",,"David Crosby, Craig Doerge",8.0
Shadowland,American Dream,studio,"Crosby, Stills, Nash & Young",57:31:00,,"March 3, 1988 - September 16, 1988","Redwood Digital Studios, Woodside, CA",Pop/Rock,"Contemporary Pop/Rock, Singer/Songwriter, Album Rock","Soothing, Pastoral, Sentimental, Smooth, Gentle, Laid-Back/Mellow, Relaxed, Summery, Sweet, Warm, Amiable/Good-Natured, Organic, Poignant, Autumnal, Earnest, Intimate, Reflective, Wistful, Literate","Affection/Fondness, Healing/Comfort, Lifecycle, Politics/Society, Zeitgeist, Reflection, World View, Parenthood, The Great Outdoors",,,,,"Graham Nash, Rick Ryan, Joe Vitale",6.0
She's Got to Be Somewhere,Sky Trails,studio,David Crosby,50:29:00,,," Groove Masters Studios, Santa Monica Rumor Mill Recording, Santa Ynez The Bamboom Room, Altadena ",Folk,"Contemporary Singer/Songwriter, Folk-Pop","Melodic, Introspective, Lyrical, Playful, Warm, Agreeable, Earnest, Earthy, Fun, Graceful, Passionate, Sprightly, Uplifting, Flowing, Soothing","Introspection, Reflection, Sunday Afternoon, Daydreaming, Open Road",,,,,James Raymond,7.0
Shining Light,Chrome Dreams II,studio,Neil Young,1:06:13,,,Feelgood's Garage,Pop/Rock,"Album Rock, Country-Rock, Hard Rock","Autumnal, Bittersweet, Freewheeling, Messy, Poignant, Reflective, Rousing, Urgent, Warm, Wistful, Yearning","Autumn, Rainy Day, Reflection",Pop/Rock,"Singer/Songwriter, Country-Rock, Album Rock","Bittersweet, Reflective, Whimsical, Wistful, Calm/Peaceful, Intimate, Relaxed, Delicate, Literate, Nostalgic, Refined, Warm, Gentle, Organic, Searching, Laid-Back/Mellow, Soft/Quiet, Melancholy, Soothing","Introspection, Reflection, Sweet Dreams, The Great Outdoors",Neil Young,8.0
Shining On Your Dreams,Crosby & Nash,studio,Crosby & Nash,1:14:17,,10-Aug-04,"Center Staging, Burbank, CA",Pop/Rock,"Contemporary Pop/Rock, Contemporary Singer/Songwriter","Earnest, Intimate, Wistful, Laid-Back/Mellow, Organic, Plaintive, Reflective, Sentimental, Amiable/Good-Natured, Bittersweet, Gentle",,,,,,"Russ Kunkel, Graham Nash",8.0
Ships in the Night,For Free,studio,David Crosby,37:29:00,,," Groove Masters, Santa Monica HZ Werks, Van Nuys Joel Jacks Studios, Santa Ynez ","Folk, Pop/Rock","Contemporary Singer/Songwriter, Jazz-Rock, Adult Contemporary","Melodic, Introspective, Lyrical, Playful, Warm, Agreeable, Earnest, Earthy, Fun, Graceful, Passionate, Sprightly, Uplifting, Flowing, Soothing","Introspection, Reflection, Sunday Afternoon, Daydreaming, Open Road",,,,,David Crosby,7.0
Shock and Awe,Living with War,studio,Neil Young,41:47:00,,"March, 2006 - April, 2006",,Pop/Rock,"Album Rock, Hard Rock","Angry, Outraged, Passionate, Searching, Urgent, Yearning","Introspection, Loss/Grief, Reflection, Revolution",Pop/Rock,"Contemporary Pop/Rock, Folk-Rock, Psychedelic/Garage, Singer/Songwriter",,,Neil Young,7.0
Shot at Me,For Free,studio,David Crosby,37:29:00,,," Groove Masters, Santa Monica HZ Werks, Van Nuys Joel Jacks Studios, Santa Ynez ","Folk, Pop/Rock","Contemporary Singer/Songwriter, Jazz-Rock, Adult Contemporary","Melodic, Introspective, Lyrical, Playful, Warm, Agreeable, Earnest, Earthy, Fun, Graceful, Passionate, Sprightly, Uplifting, Flowing, Soothing","Introspection, Reflection, Sunday Afternoon, Daydreaming, Open Road",,,,,"David Crosby, Dean Parks",7.0
Show Me,Peace Trail,studio,Neil Young,38:19:00,,,Shangrila Zuma,Pop/Rock,"Album Rock, Hard Rock, Alternative/Indie Rock","Angry, Outraged, Passionate, Searching, Urgent, Yearning","Introspection, Loss/Grief, Protest, Reflection, Revolution, World View, Yearning, Patriotism, Stay in Bed",,,,,Neil Young,4.0
Shuffle Just as Bad,Stills,studio,Stephen Stills,38:19:00,1975-06,," Criteria Studios, Miami, FL Island Studios, London, England Record Plant, Hollywood, CA ",Pop/Rock,"Contemporary Pop/Rock, Singer/Songwriter, Soft Rock",,,,,,,Stephen Stills,8.0
Sign of Love,Le Noise,studio,Neil Young,37:55:00,,,La Noise,Pop/Rock,"Album Rock, Country-Rock, Hard Rock","Dramatic, Searching, Spooky, Sprawling, Suspenseful, Weary, Yearning","Heartache, Imagination, Introspection, Late Night, Lifecycle, Loneliness, Nighttime, Yearning",,,,,Neil Young,6.0
Silver & Gold,Silver & Gold,studio,Neil Young,39:10:00,,"August 26, 1997 - May 28, 1999","Arlyn Studios, Austin, TX",Pop/Rock,"Album Rock, Country-Rock","Amiable/Good-Natured, Autumnal, Gentle, Intimate, Laid-Back/Mellow, Reflective, Soothing, Wistful",Relaxation,Pop/Rock,"Folk-Rock, Psychedelic/Garage","Calm/Peaceful, Dreamy, Lively, Yearning",In Love,Neil Young,7.0
Simple Man,Songs for Beginners,studio,Graham Nash,32:13:00,1971,,"Studio C, San Francisco, CA",Pop/Rock,"Singer/Songwriter, Soft Rock","Agreeable, Calm/Peaceful, Dreamy, Sentimental, Yearning, Flowing, Lonely, Nostalgic, Strong","Introspection, Reflection, Relationships, Relaxation",Pop/Rock,"Folk-Rock, Psychedelic/Garage","Laid-Back/Mellow, Yearning",In Love,Graham Nash,
Since I Met You,Daylight Again,studio,"Crosby, Stills & Nash",39:50:00,,,Devonshire Sound,Pop/Rock,"Contemporary Pop/Rock, Singer/Songwriter, Album Rock","Soothing, Pastoral, Sentimental, Smooth, Gentle, Laid-Back/Mellow, Relaxed, Summery, Sweet, Warm, Amiable/Good-Natured, Organic, Poignant, Autumnal, Earnest, Intimate, Reflective, Wistful, Literate","Politics/Society, Introspection, Affection/Fondness, Heartbreak, Reflection, Relationships",Pop/Rock,"Folk-Rock, Psychedelic/Garage, Adult Contemporary, Contemporary Pop/Rock","Rousing, Sensual, Lively",In Love,"Michael Stergis, Stephen Stills",8.0
Since I Met You Baby,A Letter Home,studio,Neil Young,39:33:00,,,"Third Man Records, Nashville, TN",Pop/Rock,"Album Rock, Contemporary Pop/Rock, Country-Folk, Country-Rock","Autumnal, Bittersweet, Earthy, Plaintive, Poignant, Pastoral, Reflective, Rustic, Searching, Earnest, Eccentric, Laid-Back/Mellow, Literate, Melancholy, Messy, Organic, Quirky, Ramshackle, Weary, Wistful, Cerebral, Meandering, Nostalgic, Playful, Eerie, Gentle, Intimate, Sweet","Autumn, Comfort, Feeling Blue, Healing/Comfort, Heartache, Introspection, Late Night, Other Times & Places, Reflection, Regret, Reminiscing, Solitude, Yearning",,,,,Ivory Joe Hunter,7.0
Singin' Call,Stephen Stills 2,studio,Stephen Stills,43:02:00,1971,,,Pop/Rock,"Contemporary Pop/Rock, Singer/Songwriter, Soft Rock","Amiable/Good-Natured, Literate, Passionate, Strong, Autumnal, Earnest, Intimate, Laid-Back/Mellow, Lively, Organic, Reflective, Sentimental, Wistful, Pastoral, Bittersweet, Freewheeling, Playful, Reverent, Rousing, Street-Smart","Freedom, Imagination, Late Night, Road Trip, Hanging Out, Relaxation","Country, Pop/Rock","Country-Pop, Singer/Songwriter","Dreamy, Sentimental",,Stephen Stills,8.0
Sit Yourself Down,Stephen Stills,studio,Stephen Stills,38:59:00,1970,,"London, England",Pop/Rock,"Album Rock, Contemporary Pop/Rock, Hard Rock, Singer/Songwriter","Confident, Earnest, Earthy, Freewheeling, Gritty, Gutsy, Laid-Back/Mellow, Meandering, Rollicking, Rousing, Swaggering, Yearning, Bravado","Drinking, Empowerment, Feeling Blue",Pop/Rock,"Album Rock, Contemporary Pop/Rock, Singer/Songwriter","Intimate, Reflective, Plaintive, Searching, Self-Conscious, Earnest, Sophisticated, Sparkling, Stylish, Warm",Introspection,,9.0
Sky Trails,Sky Trails,studio,David Crosby,50:29:00,,," Groove Masters Studios, Santa Monica Rumor Mill Recording, Santa Ynez The Bamboom Room, Altadena ",Folk,"Contemporary Singer/Songwriter, Folk-Pop","Melodic, Introspective, Lyrical, Playful, Warm, Agreeable, Earnest, Earthy, Fun, Graceful, Passionate, Sprightly, Uplifting, Flowing, Soothing","Introspection, Reflection, Sunday Afternoon, Daydreaming, Open Road",,,,,"David Crosby, Becca Stevens",7.0
Skychild,Earth & Sky,studio,Graham Nash,35:14:00,1980,1979,,Pop/Rock,Contemporary Singer/Songwriter,"Laid-Back/Mellow, Calm/Peaceful, Melodic, Organic, Smooth, Warm, Yearning, Agreeable, Dreamy, Exploratory, Gentle, Lonely, Poetic, Sentimental, Strong, Confessional, Flowing, Intimate, Nostalgic, Pastoral, Reassuring/Consoling, Soothing, Springlike","Relationships, Introspection, Sunday Afternoon, Affection/Fondness, Reflection, Relaxation, Sweet Dreams, Daydreaming, At the Office",,,,,Graham Nash,
Sleep Song,Songs for Beginners,studio,Graham Nash,32:13:00,1971,,"Studio C, San Francisco, CA",Pop/Rock,"Singer/Songwriter, Soft Rock","Agreeable, Calm/Peaceful, Dreamy, Sentimental, Yearning, Flowing, Lonely, Nostalgic, Strong","Introspection, Reflection, Relationships, Relaxation",,,,,Graham Nash,
Slice of Time,Croz,studio,David Crosby,47:03:00,,," Groove Masters, Santa Monica, CA Jazz At The Lincoln Center, New York, NY Radio Hill Recorders, Los Angeles, CA ",Pop/Rock,"Contemporary Pop/Rock, Contemporary Singer/Songwriter","Earnest, Poignant, Refined, Somber, Self-Conscious, Bittersweet, Brooding, Intimate, Laid-Back/Mellow, Literate, Reflective, Relaxed, Searching","Autumn, Early Morning, Introspection, Long Walk, Rainy Day, Reflection, Regret, Relaxation, Reminiscing, Solitude, Stay in Bed, Sunday Afternoon",,,,,"David Crosby, Marcus Eaton, James Raymond",7.0
Slowpoke,Looking Forward,studio,"Crosby, Stills, Nash & Young",52:54:00,,"January 23, 1997 - July 21, 1999"," Conway Studio, l Ain Bou Kellal Ga Ga's Room, Los Angeles, CA Ocean Studios, Burbank, CA ",Pop/Rock,"Contemporary Pop/Rock, Singer/Songwriter, Album Rock","Soothing, Pastoral, Sentimental, Smooth, Gentle, Laid-Back/Mellow, Relaxed, Summery, Sweet, Warm, Amiable/Good-Natured, Organic, Poignant, Autumnal, Earnest, Intimate, Reflective, Wistful, Literate","Affection/Fondness, Healing/Comfort, Lifecycle, Politics/Society, Zeitgeist, Reflection, World View, Parenthood, The Great Outdoors",Pop/Rock,"Contemporary Pop/Rock, Folk-Rock, Psychedelic/Garage, Singer/Songwriter","Dreamy, Nostalgic, Sentimental",,"Craig Evans, Neil Young",7.0
So Begins the Task,Everybody Knows,studio,Stephen Stills,40:45:00,,,"Straygator Sound, CA",Pop/Rock,"Contemporary Pop/Rock, Soft Rock","Warm, Earnest, Freewheeling, Laid-Back/Mellow, Meandering, Yearning, Agreeable, Amiable/Good-Natured","Affection/Fondness, Lifecycle, Relaxation, Feeling Blue, Comfort, Healing/Comfort, Sunday Afternoon",,,,,Stephen Stills,8.0
Soldier,Illegal Stills,studio,Stephen Stills,35:25:00,1976,,,Pop/Rock,"Contemporary Pop/Rock, Singer/Songwriter, Soft Rock",,,Pop/Rock,"Contemporary Pop/Rock, Soft Rock","Confident, Meandering, Rousing, Warm, Wistful, Amiable/Good-Natured, Carefree","Empowerment, Freedom, Hanging Out, Introspection, Reflection, Road Trip","Donnie Dacus, Stephen Stills",7.0
Soldiers of Peace,American Dream,studio,"Crosby, Stills, Nash & Young",57:31:00,,"March 3, 1988 - September 16, 1988","Redwood Digital Studios, Woodside, CA",Pop/Rock,"Contemporary Pop/Rock, Singer/Songwriter, Album Rock","Soothing, Pastoral, Sentimental, Smooth, Gentle, Laid-Back/Mellow, Relaxed, Summery, Sweet, Warm, Amiable/Good-Natured, Organic, Poignant, Autumnal, Earnest, Intimate, Reflective, Wistful, Literate","Affection/Fondness, Healing/Comfort, Lifecycle, Politics/Society, Zeitgeist, Reflection, World View, Parenthood, The Great Outdoors",Pop/Rock,"Folk-Rock, Psychedelic/Garage",Laid-Back/Mellow,,"Craig Doerge, Graham Nash, Joe Vitale",6.0
Somebody Home,Sky Trails,studio,David Crosby,50:29:00,,," Groove Masters Studios, Santa Monica Rumor Mill Recording, Santa Ynez The Bamboom Room, Altadena ",Folk,"Contemporary Singer/Songwriter, Folk-Pop","Melodic, Introspective, Lyrical, Playful, Warm, Agreeable, Earnest, Earthy, Fun, Graceful, Passionate, Sprightly, Uplifting, Flowing, Soothing","Introspection, Reflection, Sunday Afternoon, Daydreaming, Open Road",,,,,David Crosby,7.0
Somebody Other Than You,Lighthouse,studio,David Crosby,40:40:00,,,"Groove Masters Studios, Santa Monica, CA",Pop/Rock,"Contemporary Singer/Songwriter, Adult Alternative Pop/Rock, Contemporary Pop/Rock","Earnest, Poignant, Refined, Relaxed, Bittersweet, Intimate, Reflective, Brooding, Laid-Back/Mellow, Literate, Searching, Self-Conscious","Autumn, Early Morning, Introspection, Reflection, Solitude, Sunday Afternoon",,,,,"David Crosby, Michael League",6.0
Someday,Freedom,studio,Neil Young,1:01:11,,"July 25, 1988 - August 10, 1989",,Pop/Rock,"Album Rock, Hard Rock, Heartland Rock","Outraged, Angry, Angst-Ridden, Bitter, Bittersweet, Brooding, Confrontational, Melancholy, Plaintive, Poignant, Provocative, Searching",Revolution,Pop/Rock,"Album Rock, Hard Rock, Singer/Songwriter, Heartland Rock","Angry, Bitter, Confrontational, Fiery, Freewheeling, Outraged, Provocative, Searching, Urgent, Visceral, Yearning, Nostalgic, Sensual, Sentimental","Guys Night Out, Hanging Out, Revolution, In Love",Neil Young,9.0
Someday Soon,Looking Forward,studio,"Crosby, Stills, Nash & Young",52:54:00,,"January 23, 1997 - July 21, 1999"," Conway Studio, l Ain Bou Kellal Ga Ga's Room, Los Angeles, CA Ocean Studios, Burbank, CA ",Pop/Rock,"Contemporary Pop/Rock, Singer/Songwriter, Album Rock","Soothing, Pastoral, Sentimental, Smooth, Gentle, Laid-Back/Mellow, Relaxed, Summery, Sweet, Warm, Amiable/Good-Natured, Organic, Poignant, Autumnal, Earnest, Intimate, Reflective, Wistful, Literate","Affection/Fondness, Healing/Comfort, Lifecycle, Politics/Society, Zeitgeist, Reflection, World View, Parenthood, The Great Outdoors",Pop/Rock,"Folk-Rock, Psychedelic/Garage",Sentimental,In Love,Graham Nash,7.0
Someone Gonna Rescue You,Le Noise,studio,Neil Young,37:55:00,,,La Noise,Pop/Rock,"Album Rock, Country-Rock, Hard Rock","Dramatic, Searching, Spooky, Sprawling, Suspenseful, Weary, Yearning","Heartache, Imagination, Introspection, Late Night, Lifecycle, Loneliness, Nighttime, Yearning",,,,,Neil Young,6.0
Song for Susan,Daylight Again,studio,"Crosby, Stills & Nash",39:50:00,,,Devonshire Sound,Pop/Rock,"Contemporary Pop/Rock, Singer/Songwriter, Album Rock","Soothing, Pastoral, Sentimental, Smooth, Gentle, Laid-Back/Mellow, Relaxed, Summery, Sweet, Warm, Amiable/Good-Natured, Organic, Poignant, Autumnal, Earnest, Intimate, Reflective, Wistful, Literate","Politics/Society, Introspection, Affection/Fondness, Heartbreak, Reflection, Relationships","Country, Pop/Rock","Folk-Rock, Psychedelic/Garage, Adult Contemporary, Honky Tonk","Laid-Back/Mellow, Yearning, Calm/Peaceful, Romantic, Sentimental",In Love,Graham Nash,8.0
Song With No Words (Tree with No Leaves),If I Could Only Remember My Name,studio,David Crosby,37:54:00,,,"Wally Heider Studio, San Francisco, CA",Pop/Rock,"Singer/Songwriter, Contemporary Pop/Rock","Atmospheric, Autumnal, Bittersweet, Calm/Peaceful, Gentle, Intimate, Laid-Back/Mellow, Meandering, Melancholy, Organic, Spacey, Wistful, Earnest, Poignant, Reflective","Introspection, Long Walk, Rainy Day, Sunday Afternoon",,,,,David Crosby,9.0
Song X,Mirror Ball,studio,Neil Young,55:21:00,,"January 26, 1995 - February 26, 1995","A & M Studios, Hollywood, CA",Pop/Rock,"Album Rock, American Trad Rock, Country-Rock, Hard Rock","Pastoral, Rustic, Gritty, Sentimental, Calm/Peaceful, Gutsy, Insular, Intimate, Laid-Back/Mellow, Melancholy, Plaintive, Reflective, Relaxed, Sad, Weary, Wistful, Yearning, Autumnal, Bittersweet, Earthy, Literate","Comfort, Drinking, Feeling Blue, Heartache, Late Night, Regret, Reflection",Pop/Rock,"Hard Rock, Album Rock, American Trad Rock, Country-Rock, Singer/Songwriter, Southern Rock, Grunge","Gritty, Sentimental, Gutsy, Plaintive, Reflective, Weary, Aggressive, Earthy, Literate, Poignant, Complex, Earnest, Messy, Organic, Ramshackle, Searching","Feeling Blue, Regret, Introspection, Reflection",Neil Young,6.0
Soul of a Woman,Bluenote Cafe,live,Neil Young,2:26:11,2015-13-11,,,"Pop/Rock, Blues","Album Rock, Contemporary Blues, Rock & Roll, Roots Rock, Heartland Rock","Rollicking, Rousing, Earnest, Organic, Provocative, Brash, Complex, Fun, Poignant, Ramshackle, Rustic, Searching, Ambitious, Autumnal, Bittersweet, Earthy, Literate, Messy, Confrontational, Meandering, Pastoral","Reflection, Awareness, Guys Night Out, Introspection, Passion",Pop/Rock,,,,Neil Young,8.0
Southbound Tain,Reflections,box set,Graham Nash,3:43:54,3/2/2009,,,Pop/Rock,"Contemporary Pop/Rock, Singer/Songwriter, Folk-Rock, Psychedelic/Garage, Soft Rock, Album Rock, British Invasion","Amiable/Good-Natured, Literate, Poignant, Laid-Back/Mellow, Gentle, Reflective, Relaxed, Sentimental, Summery, Warm, Pastoral, Smooth, Soothing, Sweet, Intimate, Wistful, Autumnal, Earnest, Organic",,Pop/Rock,,,,Graham Nash,
Southbound Train,Graham Nash & David Crosby,studio,Crosby & Nash,35:40:00,,1972,"Wally Heider III, Los Angeles, CA",Pop/Rock,"Singer/Songwriter, Soft Rock","Pastoral, Soothing, Poignant, Smooth, Autumnal, Gentle, Intimate, Relaxed, Summery, Sweet, Warm, Amiable/Good-Natured, Earnest, Laid-Back/Mellow, Organic, Reflective, Sentimental, Wistful, Literate","Politics/Society, Introspection, Affection/Fondness, Heartbreak, Reflection, Relationships","International, Pop/Rock","Contemporary Pop/Rock, Folk-Rock, Psychedelic/Garage, Singer/Songwriter","Nostalgic, Sentimental",,Graham Nash,
Southern Cross,Daylight Again,studio,"Crosby, Stills & Nash",39:50:00,,,Devonshire Sound,Pop/Rock,"Contemporary Pop/Rock, Singer/Songwriter, Album Rock","Soothing, Pastoral, Sentimental, Smooth, Gentle, Laid-Back/Mellow, Relaxed, Summery, Sweet, Warm, Amiable/Good-Natured, Organic, Poignant, Autumnal, Earnest, Intimate, Reflective, Wistful, Literate","Politics/Society, Introspection, Affection/Fondness, Heartbreak, Reflection, Relationships",Pop/Rock,"Contemporary Pop/Rock, Singer/Songwriter, Soft Rock","Angry, Laid-Back/Mellow, Light, Relaxed, Smooth, Soft/Quiet, Soothing, Warm","At the Office, Comfort, Day Driving, Relaxation","Michael Curtis, Richard Curtis, Stephen Stills",8.0
Southern Man,After the Gold Rush,studio,Neil Young,33:41:00,,"August, 1969 - January, 1970",,Pop/Rock,"Album Rock, Country-Rock, Singer/Songwriter, Contemporary Pop/Rock","Intimate, Wistful, Calm/Peaceful, Laid-Back/Mellow, Organic, Plaintive, Poignant, Reflective, Relaxed, Soothing, Yearning, Autumnal, Bittersweet, Gentle","Autumn, Introspection, Reflection",Pop/Rock,"Singer/Songwriter, Album Rock, Hard Rock, Contemporary Pop/Rock, Folk-Rock","Angry, Confrontational, Cynical/Sarcastic, Fiery, Freewheeling, Hostile, Outraged, Provocative, Rebellious, Rousing, Searching, Urgent, Visceral, Lively, Yearning","Late Night, Night Driving, Road Trip, Politics/Society",Neil Young,10.0
Spanish Suite,Man Alive!,studio,Stephen Stills,57:51:00,,,,Pop/Rock,"Singer/Songwriter, Contemporary Pop/Rock, Album Rock","Intimate, Laid-Back/Mellow, Literate, Amiable/Good-Natured, Pastoral, Reflective, Relaxed, Summery, Earnest, Organic, Poignant, Sentimental, Smooth, Warm, Wistful, Gentle, Autumnal, Soothing, Sweet","Freedom, Hanging Out, Imagination, Late Night, Road Trip",,,,,Stephen Stills,7.0
