track,album,album_type,artist,album_duration,release_date,recording_period,recording_location,album_genre,album_styles,album_moods,album_themes,genres,styles,moods,themes,composers,user_rating
Marguerita,Whistling Down the Wire,studio,Crosby & Nash,36:36:00,1976-06,,"Sound Labs, LA, CA & Rudy Recor",Pop/Rock,"Singer/Songwriter, Album Rock, Soft Rock","Amiable/Good-Natured, Earnest, Gentle, Intimate, Laid-Back/Mellow, Organic, Poignant, Reflective, Sentimental, Wistful","Daydreaming, Dinner Ambiance, Homecoming",,,,,Graham Nash,7.0
Marianne,Stephen Stills 2,studio,Stephen Stills,43:02:00,1971,,,Pop/Rock,"Contemporary Pop/Rock, Singer/Songwriter, Soft Rock","Amiable/Good-Natured, Literate, Passionate, Strong, Autumnal, Earnest, Intimate, Laid-Back/Mellow, Lively, Organic, Reflective, Sentimental, Wistful, Pastoral, Bittersweet, Freewheeling, Playful, Reverent, Rousing, Street-Smart","Freedom, Imagination, Late Night, Road Trip, Hanging Out, Relaxation","Electronic, Pop/Rock","Blues-Rock, Club/Dance, Contemporary Pop/Rock, Singer/Songwriter","Lively, Optimistic, Sentimental",,Stephen Stills,8.0
Marrakesh Express,"Crosby, Stills & Nash",studio,"Crosby, Stills & Nash",40:52:00,,"June 26, 1968 - April 3, 1969"," Record Plant, New York, NY United Studio B, Hollywood, CA Wall ",Pop/Rock,"Contemporary Pop/Rock, Folk-Rock, Psychedelic/Garage, Singer/Songwriter, Soft Rock","Autumnal, Gentle, Amiable/Good-Natured, Intimate, Relaxed, Searching, Sentimental, Smooth, Soothing, Summery, Sweet, Warm, Yearning, Earnest, Laid-Back/Mellow, Literate, Organic, Poignant, Reflective, Wistful","Rainy Day, Relaxation, Reminiscing, Reunion, Sunday Afternoon, Imagination, Reflection, Feeling Blue, Hanging Out, Introspection, Late Night, Autumn",Pop/Rock,"Album Rock, Contemporary Pop/Rock, Singer/Songwriter, Soft Rock, Folk-Rock, Psychedelic/Garage","Amiable/Good-Natured, Organic, Earnest, Pastoral, Bright, Cheerful, Laid-Back/Mellow, Lively, Reflective, Relaxed, Spiritual","Relaxation, Summer, Road Trip",Graham Nash,9.0
Married Man,This Note's for You,studio,Neil Young,38:53:00,1988-04,"November, 1987 - January, 1988","Omni, Oakland, CA","Pop/Rock, Blues","Album Rock, Contemporary Blues, Heartland Rock, Rock & Roll, Roots Rock","Pastoral, Rustic, Autumnal, Bittersweet, Confrontational, Earthy, Literate, Poignant, Ambitious, Brash, Complex, Earnest, Fun, Meandering, Messy, Organic, Provocative, Ramshackle, Rollicking, Rousing, Searching","Introspection, Reflection","Pop/Rock, Jazz","Blues-Rock, Singer/Songwriter, Swing, Heartland Rock",Lively,"In Love, Wedding",Neil Young,6.0
Maximum,Back in Time,studio,Stephen Stills,20:00,7/12/2017,,,,,,,,,,,Stephen Stills,5.0
Medley,4 Way Street,live,"Crosby, Stills, Nash & Young",1:49:44,,"June 2, 1970 - July, 1970",,Pop/Rock,"Contemporary Pop/Rock, Singer/Songwriter, Album Rock","Literate, Pastoral, Gentle, Laid-Back/Mellow, Soft/Quiet, Yearning, Amiable/Good-Natured, Organic, Poignant, Sparse, Autumnal, Earnest, Intimate, Reflective, Whimsical, Wistful","Reflection, Reminiscing",,,,,Stephen Stills,9.0
Mellow My Mind,Tonight's the Night,studio,Neil Young,44:45:00,,,,Pop/Rock,"Album Rock, Country-Rock, Hard Rock, Singer/Songwriter","Bittersweet, Druggy, Gloomy, Indulgent, Intimate, Melancholy, Messy, Ominous, Pastoral, Reflective, Rustic, Sad, Somber, Sparse, Weary, Wistful, Ambitious, Atmospheric, Autumnal, Brooding, Cathartic, Complex, Earnest, Eccentric, Hypnotic, Lazy, Meandering, Nihilistic, Nocturnal, Organic, Ramshackle, Searching, Confrontational, Earthy, Literate, Poignant","Loss/Grief, Scary Music, Introspection, Reflection",Pop/Rock,"Album Rock, Country-Rock, Hard Rock, Singer/Songwriter, Contemporary Pop/Rock","Bittersweet, Druggy, Eccentric, Indulgent, Laid-Back/Mellow, Lazy, Messy, Nocturnal, Plaintive, Poignant, Quirky, Ramshackle, Reflective, Weary, Wistful, Yearning, Dreamy, Relaxed, Romantic","Drinking, Hanging Out, Heartache, Introspection, Late Night, Rainy Day, Reflection, Regret, In Love",Neil Young,10.0
Melody,Oh Yes I Can,studio,David Crosby,42:35:00,,,,Pop/Rock,Contemporary Pop/Rock,"Earnest, Intimate, Poignant, Reflective, Bittersweet, Gentle, Plaintive, Wistful","Drugs, Introspection, Passion, Politics/Society, Reflection, Relationships",,,,,"David Crosby, Craig Doerge",7.0
Mexico,Homegrown,studio,Neil Young,35:17:00,,," Broken Arrow Ranch Studio, Woodside, CA Quadraphonic Studios, Nashville Ramport Studios, London ",Pop/Rock,"Country-Rock, Singer/Songwriter, Soft Rock, Album Rock","Calm/Peaceful, Druggy, Light, Messy, Ramshackle, Relaxed, Soft/Quiet, Soothing, Sweet, Urgent, Warm, Weary, Angst-Ridden, Autumnal, Bittersweet, Brooding, Cathartic, Intimate, Laid-Back/Mellow, Lazy, Melancholy, Plaintive, Poignant, Reflective, Sad, Smooth, Somber, Wistful, Gentle","Open Road, Reflection, Relaxation, Reminiscing, Sunday Afternoon, Day Driving, The Great Outdoors, Daydreaming, Stay in Bed, Good Times, Loss/Grief",,,,,Neil Young,9.0
Michael (Hedges Here),Crosby & Nash,studio,Crosby & Nash,1:14:17,,10-Aug-04,"Center Staging, Burbank, CA",Pop/Rock,"Contemporary Pop/Rock, Contemporary Singer/Songwriter","Earnest, Intimate, Wistful, Laid-Back/Mellow, Organic, Plaintive, Reflective, Sentimental, Amiable/Good-Natured, Bittersweet, Gentle",,,,,,Graham Nash,8.0
Midnight in Paris,Illegal Stills,studio,Stephen Stills,35:25:00,1976,,,Pop/Rock,"Contemporary Pop/Rock, Singer/Songwriter, Soft Rock",,,,,,,,7.0
Midnight on the Bay,Long May You Run,studio,The Stills-Young Band,1:12:10,10/9/1976,"February 16, 1976 - June 7, 1976","Criteria Recording Studios, Miami, FL",Pop/Rock,"Album Rock, Contemporary Pop/Rock, Country-Rock, Singer/Songwriter","Pastoral, Rustic, Autumnal, Bittersweet, Confrontational, Earthy, Gentle, Intimate, Literate, Poignant, Wistful, Ambitious, Complex, Earnest, Meandering, Messy, Organic, Ramshackle, Searching","Introspection, Reflection",,,,,Neil Young,7.0
Midnight Rider,Thoroughfare Gap,studio,Stephen Stills,,1978,,,Pop/Rock,"Contemporary Pop/Rock, Singer/Songwriter",,,Pop/Rock,Contemporary Pop/Rock,"Confident, Earthy, Gutsy, Rousing, Searching, Swaggering, Warm, Bravado","Empowerment, Freedom, Road Trip",Gregg Allman,6.0
Might as Well Have a Good Time,Daylight Again,studio,"Crosby, Stills & Nash",39:50:00,,,Devonshire Sound,Pop/Rock,"Contemporary Pop/Rock, Singer/Songwriter, Album Rock","Soothing, Pastoral, Sentimental, Smooth, Gentle, Laid-Back/Mellow, Relaxed, Summery, Sweet, Warm, Amiable/Good-Natured, Organic, Poignant, Autumnal, Earnest, Intimate, Reflective, Wistful, Literate","Politics/Society, Introspection, Affection/Fondness, Heartbreak, Reflection, Relationships",Pop/Rock,"Folk-Rock, Psychedelic/Garage, Adult Contemporary",,,"Craig Doerge, Judy Henske",8.0
Military Madness,Songs for Beginners,studio,Graham Nash,32:13:00,1971,,"Studio C, San Francisco, CA",Pop/Rock,"Singer/Songwriter, Soft Rock","Agreeable, Calm/Peaceful, Dreamy, Sentimental, Yearning, Flowing, Lonely, Nostalgic, Strong","Introspection, Reflection, Relationships, Relaxation",,,,,Graham Nash,
Milky Way Tonight,Crosby & Nash,studio,Crosby & Nash,1:14:17,,10-Aug-04,"Center Staging, Burbank, CA",Pop/Rock,"Contemporary Pop/Rock, Contemporary Singer/Songwriter","Earnest, Intimate, Wistful, Laid-Back/Mellow, Organic, Plaintive, Reflective, Sentimental, Amiable/Good-Natured, Bittersweet, Gentle",,"Country, Folk, Pop/Rock","Adult Contemporary, Folk-Pop, Singer/Songwriter","Dreamy, Nostalgic, Sentimental",,Graham Nash,8.0
Misfits,Old Ways,studio,Neil Young,36:45:00,1985-08,"January, 1983 - April, 1985"," Austin City Limits, Austin, TX Castle, Franklin, TN House Of David, Nashville, TN ",Pop/Rock,"Album Rock, Country-Rock, Heartland Rock","Rustic, Autumnal, Bittersweet, Gentle, Intimate, Melancholy, Plaintive, Poignant, Wistful",Reflection,Country,,"Dreamy, Nostalgic, Romantic, Yearning","Loss/Grief, Politics/Society",Neil Young,6.0
Monkey and the Underdog,Oh Yes I Can,studio,David Crosby,42:35:00,,,,Pop/Rock,Contemporary Pop/Rock,"Earnest, Intimate, Poignant, Reflective, Bittersweet, Gentle, Plaintive, Wistful","Drugs, Introspection, Passion, Politics/Society, Reflection, Relationships",,,,,"David Crosby, Craig Doerge",7.0
Morning Falling,Croz,studio,David Crosby,47:03:00,,," Groove Masters, Santa Monica, CA Jazz At The Lincoln Center, New York, NY Radio Hill Recorders, Los Angeles, CA ",Pop/Rock,"Contemporary Pop/Rock, Contemporary Singer/Songwriter","Earnest, Poignant, Refined, Somber, Self-Conscious, Bittersweet, Brooding, Intimate, Laid-Back/Mellow, Literate, Reflective, Relaxed, Searching","Autumn, Early Morning, Introspection, Long Walk, Rainy Day, Reflection, Regret, Relaxation, Reminiscing, Solitude, Stay in Bed, Sunday Afternoon",,,,,"David Crosby, James Raymond",7.0
Mother Earth,Before and After,live,Neil Young,47:49:00,,,,Pop/Rock,Contemporary Singer/Songwriter,"Earnest, Gentle, Intimate, Melancholy, Poignant, Reflective, Soft/Quiet, Warm, Delicate, Laid-Back/Mellow, Literate, Organic, Wistful","Comfort, Heartache, Reflection, Feeling Blue, Introspection, Rainy Day, Healing/Comfort, Stay in Bed, Relaxation, Yearning",,,,,Neil Young,6.0
Motion Pictures,On the Beach,studio,Neil Young,39:34:00,,"November 30, 1973 - April 7, 1974","Broken Arrow Studios, San Francisco, CA",Pop/Rock,"Country-Rock, Singer/Songwriter, Album Rock","Druggy, Earthy, Messy, Ramshackle, Urgent, Weary, Ambitious, Difficult, Pastoral, Rustic, Searching, Acerbic, Angst-Ridden, Autumnal, Bittersweet, Brooding, Cathartic, Complex, Earnest, Eccentric, Intimate, Laid-Back/Mellow, Lazy, Literate, Melancholy, Nocturnal, Organic, Plaintive, Poignant, Provocative, Quirky, Reflective, Rousing, Sad, Somber, Volatile, Wistful, Confrontational, Harsh, Cerebral, Meandering, Refined, Angry, Bitter, Brash, Exuberant, Nihilistic, Self-Conscious, Aggressive, Bleak, Cynical/Sarcastic, Eerie, Gentle, Gloomy, Rollicking, Rowdy, Sweet, Trippy","Autumn, Loss/Grief, Politics/Society, Reflection, Feeling Blue, Introspection, Heartache, Late Night, Solitude",Pop/Rock,"Album Rock, Singer/Songwriter, Blues-Rock","Bittersweet, Laid-Back/Mellow, Lazy, Messy, Nocturnal, Ramshackle, Reflective, Relaxed, Warm, Weary, Wistful, Gentle","Drinking, Hanging Out, Late Night, Night Driving, Road Trip, The Great Outdoors",Neil Young,10.0
Motorcycle Mama,Comes a Time,studio,Neil Young,35:39:00,,"November 28, 1975 - November 21, 1977"," Broken Arrow, Redwood City, CA Columbia, London, England Sound Shop Recording Studios, Nashville, TN ",Pop/Rock,"Album Rock, Country-Rock, Singer/Songwriter, Soft Rock","Bittersweet, Calm/Peaceful, Earthy, Laid-Back/Mellow, Light, Plaintive, Poignant, Reflective, Relaxed, Soft/Quiet, Soothing, Sweet, Warm, Ambitious, Brooding, Cathartic, Difficult, Pastoral, Rustic, Searching, Acerbic, Angst-Ridden, Complex, Earnest, Eccentric, Literate, Melancholy, Messy, Nocturnal, Organic, Provocative, Quirky, Ramshackle, Rousing, Smooth, Volatile, Weary, Autumnal, Confrontational, Gentle, Harsh, Intimate, Wistful, Cerebral, Meandering, Refined, Sad, Somber, Angry, Bitter, Brash, Exuberant, Nihilistic, Self-Conscious, Aggressive, Bleak, Cynical/Sarcastic, Druggy, Eerie, Gloomy, Rollicking, Rowdy, Trippy","Autumn, Politics/Society, Reflection, Feeling Blue, Introspection, Heartache, Late Night, Solitude",Pop/Rock,"Album Rock, Country-Rock, Rock & Roll, Singer/Songwriter","Celebratory, Cheerful, Freewheeling, Fun, Laid-Back/Mellow, Lively, Playful, Relaxed, Rollicking, Summery, Swaggering, Warm","Cool & Cocky, Day Driving, Drinking, Guys Night Out, Hanging Out, Late Night, Night Driving, Partying, Playful, Relaxation, Road Trip, Summer, The Great Outdoors",Neil Young,9.0
Mr. Soul,Before and After,live,Neil Young,47:49:00,,,,Pop/Rock,Contemporary Singer/Songwriter,"Earnest, Gentle, Intimate, Melancholy, Poignant, Reflective, Soft/Quiet, Warm, Delicate, Laid-Back/Mellow, Literate, Organic, Wistful","Comfort, Heartache, Reflection, Feeling Blue, Introspection, Rainy Day, Healing/Comfort, Stay in Bed, Relaxation, Yearning","Pop/Rock, International","Folk-Rock, Psychedelic/Garage, Singer/Songwriter, Contemporary Pop/Rock, Adult Contemporary","Dramatic, Druggy, Eccentric, Eerie, Ethereal, Freewheeling, Hypnotic, Intense, Melancholy, Menacing, Nocturnal, Ominous, Quirky, Rollicking, Rousing, Searching, Trippy, Gloomy, Lively, Sad, Yearning","Feeling Blue, Introspection, Late Night, Night Driving, Scary Music",Neil Young,6.0
Music Is Love,If I Could Only Remember My Name,studio,David Crosby,37:54:00,,,"Wally Heider Studio, San Francisco, CA",Pop/Rock,"Singer/Songwriter, Contemporary Pop/Rock","Atmospheric, Autumnal, Bittersweet, Calm/Peaceful, Gentle, Intimate, Laid-Back/Mellow, Meandering, Melancholy, Organic, Spacey, Wistful, Earnest, Poignant, Reflective","Introspection, Long Walk, Rainy Day, Sunday Afternoon","Folk, Pop/Rock",Singer/Songwriter,"Sentimental, Optimistic","Celebration, In Love","David Crosby, Graham Nash, Neil Young",9.0
Mutiny,Whistling Down the Wire,studio,Crosby & Nash,36:36:00,1976-06,,"Sound Labs, LA, CA & Rudy Recor",Pop/Rock,"Singer/Songwriter, Album Rock, Soft Rock","Amiable/Good-Natured, Earnest, Gentle, Intimate, Laid-Back/Mellow, Organic, Poignant, Reflective, Sentimental, Wistful","Daydreaming, Dinner Ambiance, Homecoming",R&B,Funk,,,Graham Nash,7.0
My Angel,Stills,studio,Stephen Stills,38:19:00,1975-06,," Criteria Studios, Miami, FL Island Studios, London, England Record Plant, Hollywood, CA ",Pop/Rock,"Contemporary Pop/Rock, Singer/Songwriter, Soft Rock",,,,,,,Stephen Stills,8.0
My Boy,Old Ways,studio,Neil Young,36:45:00,1985-08,"January, 1983 - April, 1985"," Austin City Limits, Austin, TX Castle, Franklin, TN House Of David, Nashville, TN ",Pop/Rock,"Album Rock, Country-Rock, Heartland Rock","Rustic, Autumnal, Bittersweet, Gentle, Intimate, Melancholy, Plaintive, Poignant, Wistful",Reflection,Pop/Rock,Contemporary Pop/Rock,"Happy, Romantic",In Love,Neil Young,6.0
My Country Tis of Thee,Oh Yes I Can,studio,David Crosby,42:35:00,,,,Pop/Rock,Contemporary Pop/Rock,"Earnest, Intimate, Poignant, Reflective, Bittersweet, Gentle, Plaintive, Wistful","Drugs, Introspection, Passion, Politics/Society, Reflection, Relationships",,,,,Traditional,7.0
My Favorite Changes,Stills,studio,Stephen Stills,38:19:00,1975-06,," Criteria Studios, Miami, FL Island Studios, London, England Record Plant, Hollywood, CA ",Pop/Rock,"Contemporary Pop/Rock, Singer/Songwriter, Soft Rock",,,,,,,Stephen Stills,8.0
My Heart,Before and After,live,Neil Young,47:49:00,,,,Pop/Rock,Contemporary Singer/Songwriter,"Earnest, Gentle, Intimate, Melancholy, Poignant, Reflective, Soft/Quiet, Warm, Delicate, Laid-Back/Mellow, Literate, Organic, Wistful","Comfort, Heartache, Reflection, Feeling Blue, Introspection, Rainy Day, Healing/Comfort, Stay in Bed, Relaxation, Yearning",,,,,Neil Young,6.0
My Hometown,A Letter Home,studio,Neil Young,39:33:00,,,"Third Man Records, Nashville, TN",Pop/Rock,"Album Rock, Contemporary Pop/Rock, Country-Folk, Country-Rock","Autumnal, Bittersweet, Earthy, Plaintive, Poignant, Pastoral, Reflective, Rustic, Searching, Earnest, Eccentric, Laid-Back/Mellow, Literate, Melancholy, Messy, Organic, Quirky, Ramshackle, Weary, Wistful, Cerebral, Meandering, Nostalgic, Playful, Eerie, Gentle, Intimate, Sweet","Autumn, Comfort, Feeling Blue, Healing/Comfort, Heartache, Introspection, Late Night, Other Times & Places, Reflection, Regret, Reminiscing, Solitude, Yearning",,,,,Bruce Springsteen,7.0
My New Robot,Peace Trail,studio,Neil Young,38:19:00,,,Shangrila Zuma,Pop/Rock,"Album Rock, Hard Rock, Alternative/Indie Rock","Angry, Outraged, Passionate, Searching, Urgent, Yearning","Introspection, Loss/Grief, Protest, Reflection, Revolution, World View, Yearning, Patriotism, Stay in Bed",,,,,Neil Young,4.0
My Pledge,Peace Trail,studio,Neil Young,38:19:00,,,Shangrila Zuma,Pop/Rock,"Album Rock, Hard Rock, Alternative/Indie Rock","Angry, Outraged, Passionate, Searching, Urgent, Yearning","Introspection, Loss/Grief, Protest, Reflection, Revolution, World View, Yearning, Patriotism, Stay in Bed",,,,,Neil Young,4.0
Myself at Last,This Path Tonight,studio,Graham Nash,41:43:00,,,,Pop/Rock,"Contemporary Pop/Rock, Contemporary Singer/Songwriter","Amiable/Good-Natured, Literate, Poignant, Laid-Back/Mellow, Gentle, Reflective, Relaxed, Sentimental, Summery, Warm, Pastoral, Smooth, Soothing, Sweet, Intimate, Wistful, Autumnal, Earnest, Organic","Politics/Society, Relaxation, Small Gathering",,,,,,
Myth of Sisyphus,Stills,studio,Stephen Stills,38:19:00,1975-06,," Criteria Studios, Miami, FL Island Studios, London, England Record Plant, Hollywood, CA ",Pop/Rock,"Contemporary Pop/Rock, Singer/Songwriter, Soft Rock",,,,,,,"Kenny Passarelli, Stephen Stills",8.0
Naked in the Rain,Wind on the Water,studio,Crosby & Nash,40:57:00,,,,Pop/Rock,"Singer/Songwriter, Soft Rock, Contemporary Pop/Rock","Amiable/Good-Natured, Earnest, Gentle, Intimate, Laid-Back/Mellow, Organic, Poignant, Reflective, Sentimental, Wistful","Daydreaming, Dinner Ambiance, Homecoming",Pop/Rock,"Album Rock, Folk-Rock, Psychedelic/Garage, Singer/Songwriter, Soft Rock",Organic,,"David Crosby, Graham Nash",8.0
Name of Love,American Dream,studio,"Crosby, Stills, Nash & Young",57:31:00,,"March 3, 1988 - September 16, 1988","Redwood Digital Studios, Woodside, CA",Pop/Rock,"Contemporary Pop/Rock, Singer/Songwriter, Album Rock","Soothing, Pastoral, Sentimental, Smooth, Gentle, Laid-Back/Mellow, Relaxed, Summery, Sweet, Warm, Amiable/Good-Natured, Organic, Poignant, Autumnal, Earnest, Intimate, Reflective, Wistful, Literate","Affection/Fondness, Healing/Comfort, Lifecycle, Politics/Society, Zeitgeist, Reflection, World View, Parenthood, The Great Outdoors","Pop/Rock, International","Folk-Rock, Psychedelic/Garage, Contemporary Pop/Rock, Singer/Songwriter","Calm/Peaceful, Sentimental",,Neil Young,6.0
Natalie,Thousand Roads,studio,David Crosby,47:20:00,,," Fisher Land Farm Studio, England Groove Masters Studio, Santa Monica, CA Ocean Way Recording Studios, Hollywood, CA ",Pop/Rock,Contemporary Pop/Rock,"Earnest, Poignant, Refined, Somber, Self-Conscious, Bittersweet, Brooding, Intimate, Laid-Back/Mellow, Literate, Reflective, Relaxed, Searching","Autumn, Early Morning, Introspection, Long Walk, Rainy Day, Reflection, Regret, Relaxation, Reminiscing, Solitude, Stay in Bed, Sunday Afternoon",Pop/Rock,Singer/Songwriter,"Calm/Peaceful, Dreamy, Nostalgic, Restrained, Sentimental",,Stephen Bishop,7.0
Natural Beauty,Harvest Moon,studio,Neil Young,51:39:00,,"September, 1991 - February, 1992","Redwood Digital Studios, Woodside, CA",Pop/Rock,"Album Rock, Country-Rock","Pastoral, Rustic, Autumnal, Bittersweet, Earthy, Gentle, Intimate, Literate, Poignant, Wistful, Complex, Earnest, Meandering, Organic, Ramshackle, Searching","Introspection, Reflection",Pop/Rock,"Country-Rock, Folk-Rock, Psychedelic/Garage, Singer/Songwriter","Autumnal, Bittersweet, Brooding, Intimate, Laid-Back/Mellow, Melancholy, Plaintive, Reflective, Relaxed, Sad, Sprawling, Warm, Wistful, Yearning, Dreamy, Sentimental","Autumn, Feeling Blue, Heartache, Introspection, Rainy Day, Reflection, Politics/Society",Neil Young,7.0
Needle of Death,A Letter Home,studio,Neil Young,39:33:00,,,"Third Man Records, Nashville, TN",Pop/Rock,"Album Rock, Contemporary Pop/Rock, Country-Folk, Country-Rock","Autumnal, Bittersweet, Earthy, Plaintive, Poignant, Pastoral, Reflective, Rustic, Searching, Earnest, Eccentric, Laid-Back/Mellow, Literate, Melancholy, Messy, Organic, Quirky, Ramshackle, Weary, Wistful, Cerebral, Meandering, Nostalgic, Playful, Eerie, Gentle, Intimate, Sweet","Autumn, Comfort, Feeling Blue, Healing/Comfort, Heartache, Introspection, Late Night, Other Times & Places, Reflection, Regret, Reminiscing, Solitude, Yearning",,,,,Bert Jansch,7.0
Never War,Back in Time,studio,Stephen Stills,20:00,7/7/2017,,,,,,,,,,,Stephen Stills,5.0
New Mama,Stills,studio,Stephen Stills,38:19:00,1975-06,," Criteria Studios, Miami, FL Island Studios, London, England Record Plant, Hollywood, CA ",Pop/Rock,"Contemporary Pop/Rock, Singer/Songwriter, Soft Rock",,,,,,,Neil Young,8.0
Newday,Innocent Eyes,studio,Graham Nash,34:10:00,1986,," Devonshire Studios, LA, CA Longview Farms, Worcester, MA Rudy Records, LA, CA ",Pop/Rock,Contemporary Singer/Songwriter,,,,,,,"Craig Doerge, Graham Nash",
Night Song,American Dream,studio,"Crosby, Stills, Nash & Young",57:31:00,,"March 3, 1988 - September 16, 1988","Redwood Digital Studios, Woodside, CA",Pop/Rock,"Contemporary Pop/Rock, Singer/Songwriter, Album Rock","Soothing, Pastoral, Sentimental, Smooth, Gentle, Laid-Back/Mellow, Relaxed, Summery, Sweet, Warm, Amiable/Good-Natured, Organic, Poignant, Autumnal, Earnest, Intimate, Reflective, Wistful, Literate","Affection/Fondness, Healing/Comfort, Lifecycle, Politics/Society, Zeitgeist, Reflection, World View, Parenthood, The Great Outdoors","International, Pop/Rock","Contemporary Pop/Rock, Singer/Songwriter",Sentimental,,"Stephen Stills, Neil Young",6.0
Nighttime for Generals,American Dream,studio,"Crosby, Stills, Nash & Young",57:31:00,,"March 3, 1988 - September 16, 1988","Redwood Digital Studios, Woodside, CA",Pop/Rock,"Contemporary Pop/Rock, Singer/Songwriter, Album Rock","Soothing, Pastoral, Sentimental, Smooth, Gentle, Laid-Back/Mellow, Relaxed, Summery, Sweet, Warm, Amiable/Good-Natured, Organic, Poignant, Autumnal, Earnest, Intimate, Reflective, Wistful, Literate","Affection/Fondness, Healing/Comfort, Lifecycle, Politics/Society, Zeitgeist, Reflection, World View, Parenthood, The Great Outdoors","Electronic, International, Pop/Rock","Club/Dance, Contemporary Pop/Rock, Singer/Songwriter",,,"David Crosby, Craig Doerge",6.0
No Hidden Path,Chrome Dreams II,studio,Neil Young,1:06:13,,,Feelgood's Garage,Pop/Rock,"Album Rock, Country-Rock, Hard Rock","Autumnal, Bittersweet, Freewheeling, Messy, Poignant, Reflective, Rousing, Urgent, Warm, Wistful, Yearning","Autumn, Rainy Day, Reflection",Pop/Rock,"Singer/Songwriter, Country-Rock, Album Rock, Heartland Rock, Jam Bands","Fierce, Passionate, Gritty, Raucous, Crunchy, Dramatic, Gutsy, Searching, Self-Conscious, Street-Smart, Uncompromising, Knotty, Swaggering, Literate, Urgent, Messy","Empowerment, Freedom, Maverick, The Great Outdoors",Neil Young,8.0
No Hiding Place,Right By You,studio,Stephen Stills,37:46:00,1984,,,Pop/Rock,"Contemporary Pop/Rock, Singer/Songwriter, Soft Rock",,,,,,,,6.0
No Me Niegas,Illegal Stills,studio,Stephen Stills,35:25:00,1976,,,Pop/Rock,"Contemporary Pop/Rock, Singer/Songwriter, Soft Rock",,,,,Sad,,,7.0
No More,Freedom,studio,Neil Young,1:01:11,,"July 25, 1988 - August 10, 1989",,Pop/Rock,"Album Rock, Hard Rock, Heartland Rock","Outraged, Angry, Angst-Ridden, Bitter, Bittersweet, Brooding, Confrontational, Melancholy, Plaintive, Poignant, Provocative, Searching",Revolution,Pop/Rock,"Album Rock, Hard Rock, Contemporary Pop/Rock, Heartland Rock, Singer/Songwriter","Angry, Bitter, Confrontational, Fiery, Freewheeling, Outraged, Provocative, Searching, Urgent, Visceral, Yearning, Nostalgic, Sentimental","Guys Night Out, Hanging Out, Revolution, Feeling Blue",Neil Young,9.0
No Problem,Right By You,studio,Stephen Stills,37:46:00,1984,,,Pop/Rock,"Contemporary Pop/Rock, Singer/Songwriter, Soft Rock",,,,,,,,6.0
No Tears Left,Looking Forward,studio,"Crosby, Stills, Nash & Young",52:54:00,,"January 23, 1997 - July 21, 1999"," Conway Studio, l Ain Bou Kellal Ga Ga's Room, Los Angeles, CA Ocean Studios, Burbank, CA ",Pop/Rock,"Contemporary Pop/Rock, Singer/Songwriter, Album Rock","Soothing, Pastoral, Sentimental, Smooth, Gentle, Laid-Back/Mellow, Relaxed, Summery, Sweet, Warm, Amiable/Good-Natured, Organic, Poignant, Autumnal, Earnest, Intimate, Reflective, Wistful, Literate","Affection/Fondness, Healing/Comfort, Lifecycle, Politics/Society, Zeitgeist, Reflection, World View, Parenthood, The Great Outdoors",Pop/Rock,"Folk-Rock, Psychedelic/Garage",Aggressive,,Stephen Stills,7.0
No Wonder,Prairie Wind,studio,Neil Young,52:05:00,,"March, 2005","Master-Link, Nashville, TN",Pop/Rock,Country-Rock,"Autumnal, Bittersweet, Laid-Back/Mellow, Plaintive, Poignant, Reflective, Sentimental, Warm, Wistful","Autumn, Comfort, Introspection, Reflection",Pop/Rock,"American Trad Rock, Country-Rock, Album Rock, Singer/Songwriter, Southern Rock","Rustic, Sentimental, Ambitious, Autumnal, Bittersweet, Complex, Earnest, Earthy, Gutsy, Literate, Melancholy, Organic, Reflective, Searching, Wistful, Yearning","Comfort, Feeling Blue, Heartache, Introspection, Late Night, Reflection, Solitude",Neil Young,7.0
Nobody's Story,Dead Man,soundtrack,Neil Young,1:02:26,,27-Mar-95,"Mason St. Studios, San Francisco, CA","Pop/Rock, Stage & Screen","Film Music, Instrumental Rock, Original Score, Soundtracks","Bleak, Brooding, Melancholy, Wistful",,"Stage & Screen, Pop/Rock","Film Music, Original Score, Soundtracks, Alternative/Indie Rock, Experimental Rock, Instrumental Rock","Atmospheric, Dramatic, Earthy, Enigmatic, Gritty, Meandering, Organic, Theatrical, Weary","Imagination, Late Night, Reflection, Solitude",Neil Young,7.0
Not Fade Away,Thoroughfare Gap,studio,Stephen Stills,,1978,,,Pop/Rock,"Contemporary Pop/Rock, Singer/Songwriter",,,Pop/Rock,Contemporary Pop/Rock,"Confident, Gutsy, Rollicking, Rousing, Sentimental, Visceral, Warm","Empowerment, Freedom, Hanging Out, Road Trip","Buddy Holly, Norman Petty",6.0
Nothin' to Do But Today,Stephen Stills 2,studio,Stephen Stills,43:02:00,1971,,,Pop/Rock,"Contemporary Pop/Rock, Singer/Songwriter, Soft Rock","Amiable/Good-Natured, Literate, Passionate, Strong, Autumnal, Earnest, Intimate, Laid-Back/Mellow, Lively, Organic, Reflective, Sentimental, Wistful, Pastoral, Bittersweet, Freewheeling, Playful, Reverent, Rousing, Street-Smart","Freedom, Imagination, Late Night, Road Trip, Hanging Out, Relaxation","Pop/Rock, R&B","Early R&B, Contemporary Pop/Rock, Singer/Songwriter",Lively,,Stephen Stills,8.0
